dict_id,title,year,parental_guide,runtime,genre,directore,writer,star,storyline,gross_us_canada
{'2024544': '181. 12 Years a Slave'},12 Years a Slave,2013,R,2h 14m,"['Biography', 'Drama', 'History']",{'Steve McQueen': '2588606'},"{'John Ridley': '0725983', 'Solomon Northup': '1185849'}","{'Chiwetel Ejiofor': '0252230', 'Michael Kenneth Williams': '0931324', 'Michael Fassbender': '1055413'}","Based on an incredible true story of one man's fight for survival and freedom. In the pre-Civil War United States, <a class=""ipc-md-link ipc-md-link--entity"" href=""/name/nm1185849/"">Solomon Northup</a>, a free black man from upstate New York, is abducted and sold into slavery. Facing cruelty personified by a malevolent slave owner, as well as unexpected kindnesses, Solomon struggles not only to stay alive, but to retain his dignity. In the twelfth year of his unforgettable odyssey, Solomon's chance meeting with a Canadian abolitionist will forever alter his life.","$56,671,993"
{'0112471': '182. Before Sunrise'},Before Sunrise,1995,R,1h 41m,"['Drama', 'Romance']",{'Richard Linklater': '0000500'},"{'Richard Linklater': '0000500', 'Kim Krizan': '0471811'}","{'Ethan Hawke': '0000160', 'Julie Delpy': '0000365', 'Andrea Eckert': '0248600'}","American tourist Jesse and French student Celine meet by chance on the train from Budapest to Vienna. Sensing that they are developing a connection, Jesse asks Celine to spend the day with him in Vienna, and she agrees. So they pass the time before his scheduled flight the next morning together. How do two perfect strangers connect so intimately over the course of a single day? What is that special thing that bonds two people so strongly? As their bond turns to love, what will happen to them the next morning when Jesse flies away?","$5,535,405"
{'0015864': '183. The Gold Rush'},The Gold Rush,1925,Passed,1h 35m,"['Adventure', 'Comedy', 'Drama']",{'Charles Chaplin': '0000122'},{'Charles Chaplin': '0000122'},"{'Charles Chaplin': '0000122', 'Mack Swain': '0841501', 'Tom Murray': '0615306'}",A lone prospector ventures into Alaska looking for gold. He gets mixed up with some burly characters and falls in love with the beautiful Georgia. He tries to win her heart with his singular charm.,
{'2278388': '184. The Grand Budapest Hotel'},The Grand Budapest Hotel,2014,R,1h 39m,"['Adventure', 'Comedy', 'Crime']",{'Wes Anderson': '0027572'},"{'Stefan Zweig': '0959003', 'Wes Anderson': '0027572', 'Hugo Guinness': '2450453'}","{'Ralph Fiennes': '0000146', 'F. Murray Abraham': '0000719', 'Mathieu Amalric': '0023832'}","This movie recounts the adventures of M. Gustave (Ralph Fiennes), a legendary concierge at a famous European hotel between the wars, and Zero Moustafa (Tony Revolori), the lobby boy who becomes his most trusted friend. The story involves the theft and recovery of a priceless Renaissance painting and the battle for an enormous family fortune - all against the backdrop of a suddenly and dramatically changing continent.","$59,301,324"
{'0052618': '185. Ben-Hur'},Ben-Hur,1959,G,3h 32m,"['Adventure', 'Drama']",{'William Wyler': '0943758'},"{'Lew Wallace': '0908753', 'Karl Tunberg': '0876562', 'Gore Vidal': '0000683'}","{'Charlton Heston': '0000032', 'Jack Hawkins': '0370144', 'Stephen Boyd': '0000963'}","Judah Ben-Hur lives as a rich Jewish prince and merchant in Jerusalem at the beginning of the 1st century. Together with the new governor his old friend Messala arrives as commanding officer of the Roman legions. At first they are happy to meet after a long time but their different politic views separate them. During the welcome parade a roof tile falls down from Judah's house and injures the governor. Although Messala knows they are not guilty, he sends Judah to the galleys and throws his mother and sister into prison. But Judah swears to come back and take revenge.","$74,432,704"
{'2267998': '186. Gone Girl'},Gone Girl,2014,R,2h 29m,"['Drama', 'Mystery', 'Thriller']",{'David Fincher': '0000399'},{'Gillian Flynn': '5058839'},"{'Ben Affleck': '0000255', 'Rosamund Pike': '0683253', 'Neil Patrick Harris': '0000439'}","On the occasion of his fifth wedding anniversary, Nick Dunne reports that his wife, Amy, has gone missing. Under pressure from the police and a growing media frenzy, Nick's portrait of a blissful union begins to crumble. Soon his lies, deceits and strange behavior have everyone asking the same dark question: Did Nick Dunne kill his wife?","$167,767,189"
{'0072684': '187. Barry Lyndon'},Barry Lyndon,1975,PG,3h 5m,"['Adventure', 'Drama', 'War']",{'Stanley Kubrick': '0000040'},"{'Stanley Kubrick': '0000040', 'William Makepeace Thackeray': '0856842'}","{""Ryan O'Neal"": '0641939', 'Marisa Berenson': '0001943', 'Patrick Magee': '0535861'}","In the eighteenth century, in a small village in Ireland, Redmond Barry (Ryan O'Neal) is a young farm boy in love with his cousin Nora Brady (Gay Hamilton). When Nora gets engaged to British Captain John Quin (Leonard Rossiter), Barry challenges him to a duel of pistols. He wins and escapes to Dublin, but is robbed on the road. Without an alternative, Barry joins the British Army to fight in the Seven Years War. He deserts and is forced to join the Prussian Army, where he saves the life of his Captain and becomes his protégé and spy of Irish gambler Chevalier de Balibari (Patrick Magee). He helps Chevalier and becomes his associate until he decides to marry the wealthy Lady Lyndon (Marisa Berenson). They move to England and Barry, in his obsession of nobility, dissipates her fortune and makes a dangerous and revengeful enemy.",
{'0047296': '188. On the Waterfront'},On the Waterfront,1954,Approved,1h 48m,"['Crime', 'Drama', 'Thriller']",{'Elia Kazan': '0001415'},"{'Budd Schulberg': '0775977', 'Malcolm Johnson': '0425711', 'Robert Siodmak': '0802563'}","{'Marlon Brando': '0000008', 'Karl Malden': '0001500', 'Lee J. Cobb': '0002011'}","Terry Malloy dreams about being a prize fighter, while tending his pigeons and running errands at the docks for Johnny Friendly, the corrupt boss of the dockers union. Terry witnesses a murder by two of Johnny's thugs, and later meets the dead man's sister and feels responsible for his death. She introduces him to Father Barry, who tries to force him to provide information for the courts that will smash the dock racketeers.",
{'2119532': '189. Hacksaw Ridge'},Hacksaw Ridge,2016,R,2h 19m,"['Biography', 'Drama', 'History']",{'Mel Gibson': '0000154'},"{'Robert Schenkkan': '0770938', 'Andrew Knight': '0460795'}","{'Andrew Garfield': '1940449', 'Sam Worthington': '0941777', 'Luke Bracey': '3478396'}","The true story of <a class=""ipc-md-link ipc-md-link--entity"" href=""/name/nm3691984/"">Desmond T. Doss</a>, the conscientious objector who, after the Battle of Okinawa, was awarded the Medal of Honor for his incredible bravery and regard for his fellow soldiers. Following his upbringing and how this shaped his views (especially his religious view and anti-killing stance), Doss's trials and tribulations after enlisting in the US Army (trying to become a medic) begin, preluding the hell on Earth that was Hacksaw Ridge.","$67,209,615"
{'0107207': '190. In the Name of the Father'},In the Name of the Father,1993,R,2h 13m,"['Biography', 'Crime', 'Drama']",{'Jim Sheridan': '0006487'},"{'Gerry Conlon': '0174840', 'Terry George': '0313623', 'Jim Sheridan': '0006487'}","{'Daniel Day-Lewis': '0000358', 'Pete Postlethwaite': '0000592', 'Alison Crosbie': '0188949'}","Young Belfastian <a class=""ipc-md-link ipc-md-link--entity"" href=""/name/nm0174840/"">Gerry Conlon</a> (Daniel Day-Lewis) admits that he was in London at the time of the incident. He also admits that he is not a model citizen, having committed a petty robbery while in London. He does however profess his innocence when it comes to the bombing of the Guildford Pub in London in 1974, the event which killed several people inside. A self-professed non-political person, he and his three co-accused, dubbed the Guildford Four, are thought to be provisional members of the I.R.A. Their self-professed innocence is despite each having signed a statement of guilt which they claim were signed under duress. Their case includes having provable alibis for the time frame of the bombing. And eventually, Joe McAndrew (Don Baker), a known I.R.A. member, admits to the bombing. Dubbed the Maguire Seven, seven others, primarily members of Gerry's extended family including his father Giuseppe (Pete Postlethwaite), are accused of being accessories to the bombing. Following on the work initiated by Giuseppe, Gerry works on a campaign to prove their collective innocence, this work with the assistance of compassionate lawyer Gareth Peirce (Dame Emma Thompson). As Gareth works on this campaign, she is faced with obstacle after obstacle placed by Robert Dixon (Corin Redgrave), who led the initial investigation and questioning of the four accused on behalf of the Police.","$25,096,862"
{'0017925': '191. The General'},The General,1926,Passed,1h 18m,"['Action', 'Adventure', 'Comedy']","{'Clyde Bruckman': '0115669', 'Buster Keaton': '0000036'}","{'Buster Keaton': '0000036', 'Clyde Bruckman': '0115669', 'Al Boasberg': '0090213'}","{'Buster Keaton': '0000036', 'Marion Mack': '0533045', 'Glen Cavender': '0147070'}","Johnnie loves his train (""The General"") and Annabelle Lee. When the Civil War begins he is turned down for service because he's more valuable as an engineer. Annabelle thinks it's because he's a coward. Union spies capture The General with Annabelle on board. Johnnie must rescue both his loves.",
{'0077416': '192. The Deer Hunter'},The Deer Hunter,1978,R,3h 3m,"['Drama', 'War']",{'Michael Cimino': '0001047'},"{'Michael Cimino': '0001047', 'Deric Washburn': '0913346', 'Louis Garfinkle': '0307311'}","{'Robert De Niro': '0000134', 'Christopher Walken': '0000686', 'John Cazale': '0001030'}","Michael, Steven and Nicky are 3 best friends who enjoy going deer hunting quite often. These men get enlisted to head to Vietnam to fight for their country and celebrate with a farewell party, as well as Steven marrying a pregnant woman named ""Angela."" After the horrors during the war and edge-grabbing games of Russian Roulette that these men are forced to play, Michael returns home and realizes that his deer hunting outings aren't the same as they used to be, because of the war and he eventually finds out that Steven is handicapped and Nicky hasn't returned from Vietnam, and in response, he heads back to Vietnam to rescue him.","$48,979,328"
{'0353969': '193. Memories of Murder'},Memories of Murder,2003,Not Rated,2h 12m,"['Crime', 'Drama', 'Mystery']",{'Bong Joon Ho': '0094435'},"{'Bong Joon Ho': '0094435', 'Kwang-rim Kim': '1323286', 'Sung-bo Shim': '1646563'}","{'Song Kang-ho': '0814280', 'Kim Sang-kyung': '1235292', 'Roe-ha Kim': '1323287'}","In 1986, in the province of Gyunggi, in South Korea, a second young and beautiful woman is found dead, raped and tied and gagged with her underwear. Detective Park Doo-Man and Detective Cho Yong-koo, two brutal and stupid local detectives without any technique, investigate the murder using brutality and torturing the suspects, without any practical result. The Detective Seo Tae-Yoon from Seoul comes to the country to help the investigations and is convinced that a serial-killer is killing the women. When a third woman is found dead in the same ""modus-operandi"", the detectives find leads of the assassin.","$15,357"
{'0050986': '194. Wild Strawberries'},Wild Strawberries,1957,Not Rated,1h 31m,"['Drama', 'Romance']",{'Ingmar Bergman': '0000005'},{'Ingmar Bergman': '0000005'},"{'Victor Sjöström': '0803705', 'Bibi Andersson': '0000761', 'Ingrid Thulin': '0862026'}","With the exception of his elderly housekeeper Miss Agda who he treats almost like a surrogate platonic wife, widowed seventy-eight year old Dr. Isak Borg, a former medical doctor and professor, has retreated from any human contact, partly his own want but partly the decision of others who do not want to spend time with him because of his cold demeanor. He is traveling from his home in Stockholm to Lund to accept an honorary degree. Instead of flying as was the original plan, he decides to take the day long drive instead. Along for the ride is his daughter-in-law Marianne, who had been staying with him for the month but has now decided to go home. The many stops and encounters along the way make him reminisce about various parts of his life. Those stops which make him reminisce directly are at his childhood summer home, at the home of his equally emotionally cold mother, and at a gas station where the attendants praise him as a man for his work. But the lives of other people they encounter almost mirror his own, including hitchhikers Sara, Viktor and Anders - who remind him of his cousin Sara who he was going to marry, himself and his irresponsible brother Sigfrid who Sara eventually married - a bickering married couple Sten and Berit Alman, and Marianne and her husband and Isak's son Evald, whose marriage is as strained as was his own.",
{'0046268': '195. The Wages of Fear'},The Wages of Fear,1953,Not Rated,2h 11m,"['Adventure', 'Drama', 'Thriller']",{'Henri-Georges Clouzot': '0167241'},"{'Georges Arnaud': '1064118', 'Henri-Georges Clouzot': '0167241', 'Jérôme Géronimi': '0350823'}","{'Yves Montand': '0598971', 'Charles Vanel': '0889024', 'Peter van Eyck': '0886870'}",In the Central American jungle supplies of nitroglycerin are needed at a remote oil field. The oil company pays four men to deliver the supplies in two trucks. A tense rivalry develops between the two sets of drivers and on the rough remote roads the slightest jolt can result in death.,
{'0041959': '196. The Third Man'},The Third Man,1949,Approved,1h 33m,"['Film-Noir', 'Mystery', 'Thriller']",{'Carol Reed': '0715346'},"{'Graham Greene': '0001294', 'Orson Welles': '0000080', 'Alexander Korda': '0466099'}","{'Orson Welles': '0000080', 'Joseph Cotten': '0001072', 'Alida Valli': '0885098'}","An out of work pulp fiction novelist, Holly Martins, arrives in a post war Vienna divided into sectors by the victorious allies, and where a shortage of supplies has led to a flourishing black market. He arrives at the invitation of an ex-school friend, Harry Lime, who has offered him a job, only to discover that Lime has recently died in a peculiar traffic accident. From talking to Lime's friends and associates Martins soon notices that some of the stories are inconsistent, and determines to discover what really happened to Harry Lime.","$1,067,364"
{'3011894': '197. Wild Tales'},Wild Tales,2014,R,2h 2m,"['Comedy', 'Drama', 'Thriller']",{'Damián Szifron': '1167933'},"{'Julian Loyola': '2265326', 'Damián Szifron': '1167933', 'Germán Servidio': '1238855'}","{'Darío Grandinetti': '0334882', 'María Marull': '0555404', 'Mónica Villa': '0897640'}","The film is divided into six segments. (1) ""Pasternak"": While being on a plane, a model and a music critic realise they have a common acquaintance called Pasternak. Soon they discover that every passenger and crew member on board know Pasternak. Is this coincidence? (2) ""The Rats"": A waitress recognizes her client - it's the loan shark who caused a tragedy in her family. The cook suggests mixing rat poison with his food, but the waitress refuses. The stubborn cook, however, decides to proceed with her plan. (3) ""The Strongest"": Two drivers on a lone highway have an argument with tragic consequences. (4) ""Little Bomb"": A demolition engineer has his car towed by a truck for parking in a wrong place and he has an argument with the employee of the towing company. This event destroys his private and professional life, and he plots revenge against the corrupt towing company and the city hall. (5) ""The Proposal"": A reckless son of a wealthy family has an overnight hit-and-run accident, in which a pregnant woman gets killed. He wakes his parents up and his father calls the lawyer. The parents propose to pay the groundkeeper to take the blame for the boy. Soon the father discovers that he is a victim of extortion of his lawyer and the public prosecutor in charge of the investigation. What will be his decision? (6) ""Until Death Do Us Apart"": During the wedding party, the bride discovers that her newlywed husband has been cheating on her with one of the guests, and she decides to pay him back.","$3,106,530"
{'0015324': '198. Sherlock Jr.'},Sherlock Jr.,1924,Passed,45m,"['Action', 'Comedy', 'Romance']",{'Buster Keaton': '0000036'},"{'Jean C. Havez': '0369841', 'Joseph A. Mitchell': '0593477', 'Clyde Bruckman': '0115669'}","{'Buster Keaton': '0000036', 'Kathryn McGuire': '0570230', 'Joe Keaton': '0444172'}","A meek, mild projectionist who also cleans up after screenings, would like nothing better than to be a private detective. He becomes engaged to a pretty girl but a ladies' man known as the Sheik vies for her affection. He gets rid of the projectionist by stealing a pocket-watch belonging to the girl's father--and pawns it to buy her an expensive box of candy. He then slips the pawn ticket into the projectionist's pocket and subsequently is found by the police. He has little luck, but in his dreams he is the debonair, renowned detective Sherlock Jr., who faces danger and solves the crime. In real life, the girl solves crimes quickly.","$977,375"
{'1392190': '199. Mad Max: Fury Road'},Mad Max: Fury Road,2015,R,2h,"['Action', 'Adventure', 'Sci-Fi']",{'George Miller': '0004306'},"{'George Miller': '0004306', 'Brendan McCarthy': '0565068', 'Nick Lathouris': '0490147'}","{'Tom Hardy': '0362766', 'Charlize Theron': '0000234', 'Nicholas Hoult': '0396558'}","An apocalyptic story set in the furthest reaches of our planet, in a stark desert landscape where humanity is broken, and almost everyone is crazed fighting for the necessities of life. Within this world exist two rebels on the run who just might be able to restore order. There's Max, a man of action and a man of few words, who seeks peace of mind following the loss of his wife and child in the aftermath of the chaos. And Furiosa, a woman of action and a woman who believes her path to survival may be achieved if she can make it across the desert back to her childhood homeland.","$154,280,290"
{'0097165': '200. Dead Poets Society'},Dead Poets Society,1989,PG,2h 8m,"['Comedy', 'Drama']",{'Peter Weir': '0001837'},{'Tom Schulman': '0776114'},"{'Robin Williams': '0000245', 'Robert Sean Leonard': '0000494', 'Ethan Hawke': '0000160'}","Painfully shy Todd Anderson has been sent to the school where his popular older brother was valedictorian. His roommate, Neil Perry, although exceedingly bright and popular, is very much under the thumb of his overbearing father. The two, along with their other friends, meet Professor Keating, their new English teacher, who tells them of the Dead Poets Society, and encourages them to go against the status quo. Each does so in his own way, and is changed for life.","$95,860,116"
{'0031679': '201. Mr. Smith Goes to Washington'},Mr. Smith Goes to Washington,1939,Passed,2h 9m,"['Comedy', 'Drama']",{'Frank Capra': '0001008'},"{'Sidney Buchman': '0118227', 'Lewis R. Foster': '0287931', 'Myles Connolly': '0175333'}","{'James Stewart': '0000071', 'Jean Arthur': '0000795', 'Claude Rains': '0001647'}","Naive and idealistic Jefferson Smith, leader of the Boy Rangers, is appointed on a lark by the spineless governor of his state. He is reunited with the state's senior senator--presidential hopeful and childhood hero, Senator Joseph Paine. In Washington, however, Smith discovers many of the shortcomings of the political process as his earnest goal of a national boys' camp leads to a conflict with the state political boss, Jim Taylor. Taylor first tries to corrupt Smith and then later attempts to destroy Smith through a scandal.","$144,738"
"{'0198781': '202. Monsters, Inc.'}","Monsters, Inc.",2001,G,1h 32m,"['Animation', 'Adventure', 'Comedy']","{'Pete Docter': '0230032', 'David Silverman': '0798899', 'Lee Unkrich': '0881279'}","{'Pete Docter': '0230032', 'Jill Culton': '0191717', 'Jeff Pidgeon': '0682066'}","{'Billy Crystal': '0000345', 'John Goodman': '0000422', 'Mary Gibbs': '0316701'}","A city of monsters with no humans called Monstropolis centers around the city's power company, Monsters, Inc. The lovable, confident, tough, furry blue behemoth-like giant monster named James P. Sullivan (better known as Sulley) and his wisecracking best friend, short, green cyclops monster Mike Wazowski, discover what happens when the real world interacts with theirs in the form of a 2-year-old baby girl dubbed ""Boo,"" who accidentally sneaks into the monster world with Sulley one night. And now it's up to Sulley and Mike to send Boo back in her door before anybody finds out, especially two evil villains such as Sulley's main rival as a scarer, chameleon-like Randall (a monster that Boo is very afraid of), who possesses the ability to change the color of his skin, and Mike and Sulley's boss Mr. Waternoose, the chairman and chief executive officer of Monsters, Inc.","$290,642,256"
{'0892769': '203. How to Train Your Dragon'},How to Train Your Dragon,2010,PG,1h 38m,"['Animation', 'Action', 'Adventure']","{'Dean DeBlois': '0213450', 'Chris Sanders': '0761498'}","{'William Davies': '0204030', 'Dean DeBlois': '0213450', 'Chris Sanders': '0761498'}","{'Jay Baruchel': '0059431', 'Gerard Butler': '0124930', 'Christopher Mintz-Plasse': '2395586'}","Long ago up North on the Island of Berk, the young Viking, Hiccup, wants to join his town's fight against the dragons that continually raid their town. However, his macho father and village leader, Stoik the Vast, will not allow his small, clumsy, but inventive son to do so. Regardless, Hiccup ventures out into battle and downs a mysterious Night Fury dragon with his invention, but can't bring himself to kill it. Instead, Hiccup and the dragon, whom he dubs Toothless, begin a friendship that would open up both their worlds as the observant boy learns that his people have misjudged the species. But even as the two each take flight in their own way, they find that they must fight the destructive ignorance plaguing their world.","$217,581,231"
{'0073195': '204. Jaws'},Jaws,1975,PG,2h 4m,"['Adventure', 'Mystery', 'Thriller']",{'Steven Spielberg': '0000229'},"{'Peter Benchley': '0001940', 'Carl Gottlieb': '0331956'}","{'Roy Scheider': '0001702', 'Robert Shaw': '0001727', 'Richard Dreyfuss': '0000377'}","It's a hot summer on Amity Island, a small community whose main business is its beaches. When new Sheriff Martin Brody discovers the remains of a shark attack victim, his first inclination is to close the beaches to swimmers. This doesn't sit well with Mayor Larry Vaughn and several of the local businessmen. Brody backs down to his regret as that weekend a young boy is killed by the predator. The dead boy's mother puts out a bounty on the shark and Amity is soon swamped with amateur hunters and fisherman hoping to cash in on the reward. A local fisherman with much experience hunting sharks, Quint, offers to hunt down the creature for a hefty fee. Soon Quint, Brody and Matt Hooper from the Oceanographic Institute are at sea hunting the Great White shark. As Brody succinctly surmises after their first encounter with the creature, they're going to need a bigger boat.","$265,859,065"
{'0978762': '205. Mary and Max'},Mary and Max,2009,Not Rated,1h 32m,"['Animation', 'Comedy', 'Drama']",{'Adam Elliot': '0254178'},{'Adam Elliot': '0254178'},"{'Toni Collette': '0001057', 'Philip Seymour Hoffman': '0000450', 'Eric Bana': '0051509'}","In the mid-1970's, a homely, friendless Australian girl of 8 picks a name out of a Manhattan phone book and writes to him; she includes a chocolate bar. She's Mary Dinkle, the only child of an alcoholic mother and a distracted father. He's Max Horowitz, an overweight man with Asperger's, living alone in New York. He writes back, with chocolate. Thus begins a 20-year correspondence, interrupted by a stay in an asylum and a few misunderstandings. Mary falls in love with a neighbor, saves money to have a birthmark removed and deals with loss. Max has a friendship with a neighbor, tries to control his weight, and finally gets the dream job. Will the two ever meet face to face?",
{'0050976': '206. The Seventh Seal'},The Seventh Seal,1957,Not Rated,1h 36m,"['Drama', 'Fantasy']",{'Ingmar Bergman': '0000005'},{'Ingmar Bergman': '0000005'},"{'Max von Sydow': '0001884', 'Gunnar Björnstrand': '0085038', 'Bengt Ekerot': '0252345'}","A Knight and his squire are home from the crusades. Black Death is sweeping their country. As they approach home, Death appears to the knight and tells him it is his time. The knight challenges Death to a chess game for his life. The Knight and Death play as the cultural turmoil envelopes the people around them as they try, in different ways, to deal with the upheaval the plague has caused.",
