dict_id,title,year,parental_guide,runtime,genre,directore,writer,star,storyline,gross_us_canada
{'0021749': '54. City Lights'},City Lights,1931,G,1h 27m,"['Comedy', 'Drama', 'Romance']",{'Charles Chaplin': '0000122'},"{'Charles Chaplin': '0000122', 'Harry Carr': '0139714', 'Harry Crocker': '0188357'}","{'Charles Chaplin': '0000122', 'Virginia Cherrill': '0156039', 'Florence Lee': '5681967'}",A tramp falls in love with a beautiful blind girl. Her family is in financial trouble. The tramp's on-and-off friendship with a wealthy man allows him to be the girl's benefactor and suitor.,"$19,181"
{'0078788': '55. Apocalypse Now'},Apocalypse Now,1979,R,2h 27m,"['Drama', 'Mystery', 'War']",{'Francis Ford Coppola': '0000338'},"{'John Milius': '0587518', 'Francis Ford Coppola': '0000338', 'Michael Herr': '0380282'}","{'Martin Sheen': '0000640', 'Marlon Brando': '0000008', 'Robert Duvall': '0000380'}","It is the height of the war in Vietnam, and U.S. Army Captain Willard is sent by Colonel Lucas and a General to carry out a mission that, officially, 'does not exist - nor will it ever exist'. The mission: To seek out a mysterious Green Beret Colonel, Walter Kurtz, whose army has crossed the border into Cambodia and is conducting hit-and-run missions against the Viet Cong and NVA. The army believes Kurtz has gone completely insane and Willard's job is to eliminate him. Willard, sent up the Nung River on a U.S. Navy patrol boat, discovers that his target is one of the most decorated officers in the U.S. Army. His crew meets up with surfer-type Lt-Colonel Kilgore, head of a U.S Army helicopter cavalry group which eliminates a Viet Cong outpost to provide an entry point into the Nung River. After some hair-raising encounters, in which some of his crew are killed, Willard, Lance and Chef reach Colonel Kurtz's outpost, beyond the Do Lung Bridge. Now, after becoming prisoners of Kurtz, will Willard & the others be able to fulfill their mission?","$96,042,913"
{'0209144': '56. Memento'},Memento,2000,R,1h 53m,"['Mystery', 'Thriller']",{'Christopher Nolan': '0634240'},"{'Christopher Nolan': '0634240', 'Jonathan Nolan': '0634300'}","{'Guy Pearce': '0001602', 'Carrie-Anne Moss': '0005251', 'Joe Pantoliano': '0001592'}","Memento chronicles two separate stories of Leonard, an ex-insurance investigator who can no longer build new memories, as he attempts to find the murderer of his wife, which is the last thing he remembers. One story line moves forward in time while the other tells the story backwards revealing more each time.","$25,544,867"
{'1853728': '57. Django Unchained'},Django Unchained,2012,R,2h 45m,"['Drama', 'Western']",{'Quentin Tarantino': '0000233'},{'Quentin Tarantino': '0000233'},"{'Jamie Foxx': '0004937', 'Christoph Waltz': '0910607', 'Leonardo DiCaprio': '0000138'}","In 1858, a bounty-hunter named King Schultz seeks out a slave named Django and buys him because he needs him to find some men he is looking for. After finding them, Django wants to find his wife, Broomhilda, who along with him were sold separately by his former owner for trying to escape. Schultz offers to help him if he chooses to stay with him and be his partner. Eventually they learn that she was sold to a plantation in Mississippi. Knowing they can't just go in and say they want her, they come up with a plan so that the owner will welcome them into his home and they can find a way.","$162,805,434"
{'0082971': '58. Indiana Jones and the Raiders of the Lost Ark'},Indiana Jones and the Raiders of the Lost Ark,1981,PG,1h 55m,"['Action', 'Adventure']",{'Steven Spielberg': '0000229'},"{'Lawrence Kasdan': '0001410', 'George Lucas': '0000184', 'Philip Kaufman': '0442241'}","{'Harrison Ford': '0000148', 'Karen Allen': '0000261', 'Paul Freeman': '0293550'}","The year is 1936. An archeology professor named Indiana Jones is venturing in the jungles of South America searching for a golden statue. Unfortunately, he sets off a deadly trap but miraculously escapes. Then, Jones hears from a museum curator named Marcus Brody about a biblical artifact called The Ark of the Covenant, which can hold the key to human existence. Jones has to venture to vast places such as Nepal and Egypt to find this artifact. However, he will have to fight his enemy Rene Belloq and a band of Nazis in order to reach it.","$248,159,971"
{'0910970': '59. WALL·E'},WALL·E,2008,G,1h 38m,"['Animation', 'Adventure', 'Family']",{'Andrew Stanton': '0004056'},"{'Andrew Stanton': '0004056', 'Pete Docter': '0230032', 'Jim Reardon': '0714114'}","{'Ben Burtt': '0123785', 'Elissa Knight': '2264184', 'Jeff Garlin': '0307531'}","In a distant, but not so unrealistic, future where mankind has abandoned earth because it has become covered with trash from products sold by the powerful multi-national Buy N Large corporation, WALL-E, a garbage collecting robot has been left to clean up the mess. Mesmerized with trinkets of Earth's history and show tunes, WALL-E is alone on Earth except for a sprightly pet cockroach. One day, EVE, a sleek (and dangerous) reconnaissance robot, is sent to Earth to find proof that life is once again sustainable. WALL-E falls in love with EVE. WALL-E rescues EVE from a dust storm and shows her a living plant he found amongst the rubble. Consistent with her ""directive"", EVE takes the plant and automatically enters a deactivated state except for a blinking green beacon. WALL-E, doesn't understand what has happened to his new friend, but, true to his love, he protects her from wind, rain, and lightning, even as she is unresponsive. One day a massive ship comes to reclaim EVE, but WALL-E, out of love or loneliness, hitches a ride on the outside of the ship to rescue EVE. The ship arrives back at a large space cruise ship, which is carrying all of the humans who evacuated Earth 700 years earlier. The people of Earth ride around this space resort on hovering chairs which give them a constant feed of TV and video chatting. They drink all of their meals through a straw out of laziness and/or bone loss, and are all so fat that they can barely move. When the auto-pilot computer, acting on hastily-given instructions sent many centuries before, tries to prevent the people of Earth from returning by stealing the plant, WALL-E, EVE, the portly captain, and a band of broken robots stage a mutiny.","$223,808,164"
{'0405094': '60. The Lives of Others'},The Lives of Others,2006,R,2h 17m,"['Drama', 'Mystery', 'Thriller']",{'Florian Henckel von Donnersmarck': '0003697'},{'Florian Henckel von Donnersmarck': '0003697'},"{'Ulrich Mühe': '0618057', 'Martina Gedeck': '0311476', 'Sebastian Koch': '0462407'}","Gerd Wiesler is an officer with the Stasi, the East German secret police. The film begins in 1984 when Wiesler attends a play written by Georg Dreyman, who is considered by many to be the ultimate example of the loyal citizen. Wiesler has a gut feeling that Dreyman can't be as ideal as he seems, and believes surveillance is called for. The Minister of Culture agrees but only later does Wiesler learn that the Minister sees Dreyman as a rival and lusts after his partner Christa-Maria. The more time he spends listening in on them, the more he comes to care about them. The once rigid Stasi officer begins to intervene in their lives, in a positive way, protecting them whenever possible. Eventually, Wiesler's activities catch up to him and while there is no proof of wrongdoing, he finds himself in menial jobs - until the unbelievable happens.","$11,286,112"
{'0043014': '61. Sunset Blvd.'},Sunset Blvd.,1950,Passed,1h 50m,"['Drama', 'Film-Noir']",{'Billy Wilder': '0000697'},"{'Charles Brackett': '0102818', 'Billy Wilder': '0000697', 'D.M. Marshman Jr.': '0551261'}","{'William Holden': '0000034', 'Gloria Swanson': '0841797', 'Erich von Stroheim': '0002233'}","In early-1950s Hollywood, obscure screenplay-writer Joe Gillis is unable to sell his work to the studios, is full of debts and thinking of returning to his hometown to work in an office. While trying to escape from his creditors, he has a flat tire and parks his car in a decadent mansion in Sunset Boulevard. He meets the owner and former silent-movie star Norma Desmond, who lives alone with her butler and driver Max Von Mayerling. Norma is demented and believes she will return to the cinema industry, and is protected and isolated from the world by Max, who was her director and husband in the past and still loves her. Norma proposes Joe to move to the mansion and help her in writing a screenplay for her comeback to the cinema, and the small-time writer becomes her lover and gigolo. When Joe falls in love with young aspiring writer Betty Schaefer, Norma becomes jealous and completely insane and her madness leads to a tragic end.","$299,645"
{'0050825': '62. Paths of Glory'},Paths of Glory,1957,Approved,1h 28m,"['Drama', 'War']",{'Stanley Kubrick': '0000040'},"{'Stanley Kubrick': '0000040', 'Calder Willingham': '0932229', 'Jim Thompson': '0860292'}","{'Kirk Douglas': '0000018', 'Ralph Meeker': '0576127', 'Adolphe Menjou': '0579663'}",The futility and irony of the war in the trenches in WWI is shown as a unit commander in the French army must deal with the mutiny of his men and a glory-seeking general after part of his force falls back under fire in an impossible attack.,
{'4154756': '63. Avengers: Infinity War'},Avengers: Infinity War,2018,PG-13,2h 29m,"['Action', 'Adventure', 'Sci-Fi']","{'Anthony Russo': '0751577', 'Joe Russo': '0751648'}","{'Christopher Markus': '1321655', 'Stephen McFeely': '1321656', 'Stan Lee': '0498278'}","{'Robert Downey Jr.': '0000375', 'Chris Hemsworth': '1165110', 'Mark Ruffalo': '0749263'}","As the Avengers and their allies have continued to protect the world from threats too large for any one hero to handle, a new danger has emerged from the cosmic shadows: Thanos. A despot of intergalactic infamy, his goal is to collect all six Infinity Stones, artifacts of unimaginable power, and use them to inflict his twisted will on all of reality. Everything the Avengers have fought for has led up to this moment, the fate of Earth and existence has never been more uncertain.","$678,815,482"
{'0081505': '64. The Shining'},The Shining,1980,R,2h 26m,"['Drama', 'Horror']",{'Stanley Kubrick': '0000040'},"{'Stephen King': '0000175', 'Stanley Kubrick': '0000040', 'Diane Johnson': '0424956'}","{'Jack Nicholson': '0000197', 'Shelley Duvall': '0001167', 'Danny Lloyd': '0515950'}","Haunted by a persistent writer's block, the aspiring author and recovering alcoholic, Jack Torrance, drags his wife, Wendy, and his gifted son, Danny, up snow-capped Colorado's secluded Overlook Hotel after taking up a job as an off-season caretaker. As the cavernous hotel shuts down for the season, the manager gives Jack a grand tour, and the facility's chef, the ageing Mr Hallorann, has a fascinating chat with Danny about a rare psychic gift called ""The Shining"", making sure to warn him about the hotel's abandoned rooms, and, in particular, the off-limits Room 237. However, instead of overcoming the dismal creative rut, little by little, Jack starts losing his mind, trapped in an unforgiving environment of seemingly endless snowstorms, and a gargantuan silent prison riddled with strange occurrences and eerie visions. Now, the incessant voices inside Jack's head demand sacrifice. Is Jack capable of murder?","$45,634,352"
{'0032553': '65. The Great Dictator'},The Great Dictator,1940,G,2h 5m,"['Comedy', 'Drama', 'War']",{'Charles Chaplin': '0000122'},{'Charles Chaplin': '0000122'},"{'Charles Chaplin': '0000122', 'Paulette Goddard': '0002104', 'Jack Oakie': '0642988'}","20 years after the end of WWI, in which the nation of Tomainia was on the losing side, Adenoid Hynkel has risen to power as the ruthless dictator of the country. He believes in a pure Aryan state and the decimation of the Jews. This situation is unknown to a simple Jewish Tomainian barber who has been hospitalized since a WWI battle. Upon his release the barber, who had been suffering from memory loss about the war, is shown the new persecuted life of the Jews by many living in the Jewish ghetto, including a washerwoman named Hannah with whom he begins a relationship. The barber is ultimately spared such persecution by Commander Schultz, whom he saved in that WWI battle. The lives of all Jews in Tomainia are eventually spared with a policy shift by Hynkel himself, who is doing so for ulterior motives. But those motives include a desire for world domination, starting with the invasion of neighboring Osterlich, which may be threatened by Benzino Napaloni, the dictator of neighboring Bacteria. Ultimately Schultz, who has turned traitor against Hynkel's regime, and the barber may be able to join forces to take control of the situation, using Schultz's inside knowledge of the regime's workings and the barber's uncanny resemblance to one of those in power.",
{'0051201': '66. Witness for the Prosecution'},Witness for the Prosecution,1957,Approved,1h 56m,"['Crime', 'Drama', 'Mystery']",{'Billy Wilder': '0000697'},"{'Agatha Christie': '0002005', 'Billy Wilder': '0000697', 'Harry Kurnitz': '0475823'}","{'Tyrone Power': '0000061', 'Marlene Dietrich': '0000017', 'Charles Laughton': '0001452'}","Ailing barrister Sir Wilfrid Robarts is thrust back into the courtroom in what becomes one of the most unusual and eventful murder cases of the lawyer's career when he finds himself defending Leonard Vole, a man being tried for the murder of a wealthy woman. With Robarts choosing to represent him, the two find themselves up against Leonard's cold-hearted wife, Christine - who, in a surprising turn of events, chooses to appear in court against her husband.",
{'4633694': '67. Spider-Man: Into the Spider-Verse'},Spider-Man: Into the Spider-Verse,2018,PG,1h 57m,"['Animation', 'Action', 'Adventure']","{'Bob Persichetti': '2130108', 'Peter Ramsey': '0709056', 'Rodney Rothman': '0745247'}","{'Phil Lord': '0520488', 'Rodney Rothman': '0745247'}","{'Shameik Moore': '4271336', 'Jake Johnson': '2159926', 'Hailee Steinfeld': '2794962'}","Phil Lord and Christopher Miller, the creative minds behind The Lego Movie and 21 Jump Street, bring their unique talents to a fresh vision of a different Spider-Man Universe, with a groundbreaking visual style that's the first of its kind. ""Spider-Man(TM): Into the Spider-Verse"" introduces Brooklyn teen Miles Morales (Shameik Moore), and the limitless possibilities of the Spider-Verse, where more than one can wear the mask.","$190,241,310"
{'0090605': '68. Aliens'},Aliens,1986,R,2h 17m,"['Action', 'Adventure', 'Sci-Fi']",{'James Cameron': '0000116'},"{'James Cameron': '0000116', 'David Giler': '0318429', 'Walter Hill': '0001353'}","{'Sigourney Weaver': '0000244', 'Michael Biehn': '0000299', 'Carrie Henn': '0001343'}","57 years after Ellen Ripley had a close encounter with the reptilian alien creature from the first movie, she is called back, this time, to help a group of highly trained colonial marines fight off against the sinister extraterrestrials. But this time, the aliens have taken over a space colony on the moon LV-426. When the colonial marines are called upon to search the deserted space colony, they later find out that they are up against more than what they bargained for. Using specially modified machine guns and enough firepower, it's either fight or die as the space marines battle against the aliens. As the Marines do their best to defend themselves, Ripley must attempt to protect a young girl who is the sole survivor of the nearly wiped out space colony.","$85,160,248"
{'1345836': '69. The Dark Knight Rises'},The Dark Knight Rises,2012,PG-13,2h 44m,"['Action', 'Drama', 'Thriller']",{'Christopher Nolan': '0634240'},"{'Jonathan Nolan': '0634300', 'Christopher Nolan': '0634240', 'David S. Goyer': '0275286'}","{'Christian Bale': '0000288', 'Tom Hardy': '0362766', 'Anne Hathaway': '0004266'}","Despite his tarnished reputation after the events of The Dark Knight (2008), in which he took the rap for Dent's crimes, Batman feels compelled to intervene to assist the city and its Police force, which is struggling to cope with Bane's plans to destroy the city.","$448,149,584"
{'0169547': '70. American Beauty'},American Beauty,1999,R,2h 2m,['Drama'],{'Sam Mendes': '0005222'},{'Alan Ball': '0050332'},"{'Kevin Spacey': '0000228', 'Annette Bening': '0000906', 'Thora Birch': '0000301'}","After his death sometime in his 43rd year, suburbanite Lester Burnham tells of the last few weeks of his life, during which he had no idea of his imminent passing. He is a husband to real estate agent Carolyn Burnham and father to high school student Jane Burnham. Although Lester and Carolyn once loved each other, they now merely tolerate each other. Typical wallflower Jane also hates both her parents; the three suffer individually in silence in their home life. Jane tries to steer clear of both her parents. Carolyn, relatively new to the real estate business, wants to create the persona of success to further her career, aspiring to the professional life of Buddy Kane, the king of the real estate business in their neighborhood. Lester merely walks mindlessly through life, including at his job in advertising. His company is downsizing, and he, like all the other employees, has to justify his position to the newly hired efficiency expert to keep his job. Things change for Lester when he falls in love at first sight with Jane's more experienced classmate, Angela Hayes. Both Janie and Angela can see Lester's sexual infatuation with Angela, who courts such attention from any man as a sign that she is model material, she having once appeared in Seventeen and is a career to which she aspires. Lester's infatuation with Angela gives him a reenergized view on life, where he openly doesn't care anymore what anyone thinks about what he does, anyone except Angela. This infatuation coincides with the Fittses moving in next door: homophobic disciplinarian US Marine Colonel Frank Fitts who rules the house with a military fist (that fist being both figurative and literal), his semi-comatose wife Barbara Fitts, and their bright and quietly subversive 18-year-old son Ricky Fitts, who openly abides by his father's rules while behind the scenes lives by his own quite different perspective. Much like Lester's infatuation, Ricky immediately becomes infatuated with Jane; he considers girls like Angela as ordinary. The entry of Angela and the Fittses into the Burnhams' lives ultimately leads to each of the players confronting what is truly in his or her heart.","$130,096,601"
{'0361748': '71. Inglourious Basterds'},Inglourious Basterds,2009,R,2h 33m,"['Adventure', 'Drama', 'War']",{'Quentin Tarantino': '0000233'},{'Quentin Tarantino': '0000233'},"{'Brad Pitt': '0000093', 'Diane Kruger': '1208167', 'Eli Roth': '0744834'}","In German-occupied France, young Jewish refugee Shosanna Dreyfus witnesses the slaughter of her family by Colonel Hans Landa. Narrowly escaping with her life, she plots her revenge several years later when German war hero Fredrick Zoller takes a rapid interest in her and arranges an illustrious movie premiere at the theater she now runs. With the promise of every major Nazi officer in attendance, the event catches the attention of the ""Basterds"", a group of Jewish-American guerrilla soldiers led by the ruthless Lt. Aldo Raine. As the relentless executioners advance and the conspiring young girl's plans are set in motion, their paths will cross for a fateful evening that will shake the very annals of history.","$120,540,719"
{'0057012': '72. Dr. Strangelove or: How I Learned to Stop Worrying and Love the Bomb'},Dr. Strangelove or: How I Learned to Stop Worrying and Love the Bomb,1964,PG,1h 35m,"['Comedy', 'War']",{'Stanley Kubrick': '0000040'},"{'Stanley Kubrick': '0000040', 'Terry Southern': '0816143', 'Peter George': '0313570'}","{'Peter Sellers': '0000634', 'George C. Scott': '0001715', 'Sterling Hayden': '0001330'}","Paranoid Brigadier General Jack D. Ripper of Burpelson Air Force Base, believing that fluoridation of the American water supply is a Soviet plot to poison the U.S. populace, is able to deploy through a back door mechanism a nuclear attack on the Soviet Union without the knowledge of his superiors, including the Chair of the Joint Chiefs of Staff, General Buck Turgidson, and President Merkin Muffley. Only Ripper knows the code to recall the B-52 bombers and he has shut down communication in and out of Burpelson as a measure to protect this attack. Ripper's executive officer, RAF Group Captain Lionel Mandrake (on exchange from Britain), who is being held at Burpelson by Ripper, believes he knows the recall codes if he can only get a message to the outside world. Meanwhile at the Pentagon War Room, key persons including Muffley, Turgidson and nuclear scientist and adviser, a former Nazi named Dr. Strangelove, are discussing measures to stop the attack or mitigate its blow-up into an all out nuclear war with the Soviets. Against Turgidson's wishes, Muffley brings Soviet Ambassador Alexi de Sadesky into the War Room, and get his boss, Soviet Premier Dimitri Kisov, on the hot line to inform him of what's going on. The Americans in the War Room are dismayed to learn that the Soviets have an as yet unannounced Doomsday Device to detonate if any of their key targets are hit. As Ripper, Mandrake and those in the War Room try and work the situation to their end goal, Major T.J. ""King"" Kong, one of the B-52 bomber pilots, is working on his own agenda of deploying his bomb where ever he can on enemy soil if he can't make it to his intended target.","$9,440,272"
{'0364569': '73. Oldboy'},Oldboy,2003,R,2h,"['Action', 'Drama', 'Mystery']",{'Park Chan-wook': '0661791'},"{'Garon Tsuchiya': '1628380', 'Nobuaki Minegishi': '2057405', 'Park Chan-wook': '0661791'}","{'Choi Min-sik': '0158856', 'Yoo Ji-tae': '0949167', 'Kang Hye-jeong': '1367246'}","Oh Dae-Su, an obnoxious drunk abducted on a rainy night in 1988, wakes up in a strange, windowless hotel room. Kept under lock and key for an unknown reason, Oh Dae-Su's invisible captors keep him fed and systematically sedated to avert suicide, providing only a colour television to keep him company. And after fifteen long years in captivity, perplexed Oh Dae-Su finds himself released. Now, his pitiless abductors encourage Oh Dae-Su to track down the ones behind the mysterious kidnapping and finally get his brutal, longed-for revenge on the unknown tormentor. However, who would hate Oh Dae-Su so much that he would deny him a quick and clean death?","$2,347,649"
{'2380307': '74. Coco'},Coco,2017,PG,1h 45m,"['Animation', 'Adventure', 'Drama']","{'Lee Unkrich': '0881279', 'Adrian Molina': '2937122'}","{'Lee Unkrich': '0881279', 'Jason Katz': '0441735', 'Matthew Aldrich': '0017690'}","{'Anthony Gonzalez': '5645519', 'Gael García Bernal': '0305558', 'Benjamin Bratt': '0000973'}","Despite his family's baffling generations-old ban on music, Miguel dreams of becoming an accomplished musician like his idol, Ernesto de la Cruz. Desperate to prove his talent, Miguel finds himself in the stunning and colorful Land of the Dead following a mysterious chain of events. Along the way, he meets charming trickster Hector, and together, they set off on an extraordinary journey to unlock the real story behind Miguel's family history.","$210,460,015"
{'0086879': '75. Amadeus'},Amadeus,1984,PG,2h 40m,"['Biography', 'Drama', 'Music']",{'Milos Forman': '0001232'},"{'Peter Shaffer': '0787323', 'Zdenek Mahler': '0537004'}","{'F. Murray Abraham': '0000719', 'Tom Hulce': '0001371', 'Elizabeth Berridge': '0000931'}","<a class=""ipc-md-link ipc-md-link--entity"" href=""/name/nm0758283/"">Antonio Salieri</a> believes that <a class=""ipc-md-link ipc-md-link--entity"" href=""/name/nm0003665/"">Wolfgang Amadeus Mozart</a>'s music is divine and miraculous. He wishes he was himself as good a musician as Mozart so that he can praise the Lord through composing. He began his career as a devout man who believes his success and talent as a composer are God's rewards for his piety. He's also content as the respected, financially well-off, court composer of Austrian Emperor Joseph II. But he's shocked to learn that Mozart is such a vulgar creature, and can't understand why God favored Mozart to be his instrument. Salieri's envy has made him an enemy of God whose greatness was evident in Mozart. He is ready to take revenge against God and Mozart for his own musical mediocrity.","$51,973,029"
{'0114709': '76. Toy Story'},Toy Story,1995,G,1h 21m,"['Animation', 'Adventure', 'Comedy']",{'John Lasseter': '0005124'},"{'John Lasseter': '0005124', 'Pete Docter': '0230032', 'Andrew Stanton': '0004056'}","{'Tom Hanks': '0000158', 'Tim Allen': '0000741', 'Don Rickles': '0725543'}","A little boy named Andy loves to be in his room, playing with his toys, especially his doll named ""Woody"". But, what do the toys do when Andy is not with them, they come to life. Woody believes that his life (as a toy) is good. However, he must worry about Andy's family moving, and what Woody does not know is about Andy's birthday party. Woody does not realize that Andy's mother gave him an action figure known as Buzz Lightyear, who does not believe that he is a toy, and quickly becomes Andy's new favorite toy. Woody, who is now consumed with jealousy, tries to get rid of Buzz. Then, both Woody and Buzz are now lost. They must find a way to get back to Andy before he moves without them, but they will have to pass through a ruthless toy killer, Sid Phillips.","$223,225,679"
