dict_id,title,year,parental_guide,runtime,genre,directore,writer,star,storyline,gross_us_canada
{'0111161': '1. The Shawshank Redemption'},The Shawshank Redemption,1994,R,2h 22m,['Drama'],{'Frank Darabont': '0001104'},"{'Stephen King': '0000175', 'Frank Darabont': '0001104'}","{'Tim Robbins': '0000209', 'Morgan Freeman': '0000151', 'Bob Gunton': '0348409'}","Chronicles the experiences of a formerly successful banker as a prisoner in the gloomy jailhouse of Shawshank after being found guilty of a crime he did not commit. The film portrays the man's unique way of dealing with his new, torturous life; along the way he befriends a number of fellow prisoners, most notably a wise long-term inmate named Red.","$28,767,189"
{'0068646': '2. The Godfather'},The Godfather,1972,R,2h 55m,"['Crime', 'Drama']",{'Francis Ford Coppola': '0000338'},"{'Mario Puzo': '0701374', 'Francis Ford Coppola': '0000338'}","{'Marlon Brando': '0000008', 'Al Pacino': '0000199', 'James Caan': '0001001'}","The Godfather ""Don"" Vito Corleone is the head of the Corleone mafia family in New York. He is at the event of his daughter's wedding. Michael, Vito's youngest son and a decorated WW II Marine is also present at the wedding. Michael seems to be uninterested in being a part of the family business. Vito is a powerful man, and is kind to all those who give him respect but is ruthless against those who do not. But when a powerful and treacherous rival wants to sell drugs and needs the Don's influence for the same, Vito refuses to do it. What follows is a clash between Vito's fading old values and the new ways which may cause Michael to do the thing he was most reluctant in doing and wage a mob war against all the other mafia families which could tear the Corleone family apart.","$136,381,073"
{'0468569': '3. The Dark Knight'},The Dark Knight,2008,PG-13,2h 32m,"['Action', 'Crime', 'Drama']",{'Christopher Nolan': '0634240'},"{'Jonathan Nolan': '0634300', 'Christopher Nolan': '0634240', 'David S. Goyer': '0275286'}","{'Christian Bale': '0000288', 'Heath Ledger': '0005132', 'Aaron Eckhart': '0001173'}","Set within a year after the events of Batman Begins (2005), Batman, Lieutenant James Gordon, and new District Attorney Harvey Dent successfully begin to round up the criminals that plague Gotham City, until a mysterious and sadistic criminal mastermind known only as ""The Joker"" appears in Gotham, creating a new wave of chaos. Batman's struggle against The Joker becomes deeply personal, forcing him to ""confront everything he believes"" and improve his technology to stop him. A love triangle develops between Bruce Wayne, Dent, and Rachel Dawes.","$534,987,076"
{'0071562': '4. The Godfather Part II'},The Godfather Part II,1974,R,3h 22m,"['Crime', 'Drama']",{'Francis Ford Coppola': '0000338'},"{'Francis Ford Coppola': '0000338', 'Mario Puzo': '0701374'}","{'Al Pacino': '0000199', 'Robert De Niro': '0000134', 'Robert Duvall': '0000380'}","The continuing saga of the Corleone crime family tells the story of a young Vito Corleone growing up in Sicily and in 1910s New York; and follows Michael Corleone in the 1950s as he attempts to expand the family business into Las Vegas, Hollywood and Cuba.","$47,834,595"
{'0050083': '5. 12 Angry Men'},12 Angry Men,1957,Approved,1h 36m,"['Crime', 'Drama']",{'Sidney Lumet': '0001486'},{'Reginald Rose': '0741627'},"{'Henry Fonda': '0000020', 'Lee J. Cobb': '0002011', 'Martin Balsam': '0000842'}","The defense and the prosecution have rested, and the jury is filing into the jury room to decide if a young man is guilty or innocent of murdering his father. What begins as an open-and-shut case of murder soon becomes a detective story that presents a succession of clues creating doubt, and a mini-drama of each of the jurors' prejudices and preconceptions about the trial, the accused, AND each other. Based on the play, all of the action takes place on the stage of the jury room.",
"{'0108052': ""6. Schindler's List""}",Schindler's List,1993,R,3h 15m,"['Biography', 'Drama', 'History']",{'Steven Spielberg': '0000229'},"{'Thomas Keneally': '0447745', 'Steven Zaillian': '0001873'}","{'Liam Neeson': '0000553', 'Ralph Fiennes': '0000146', 'Ben Kingsley': '0001426'}","Oskar Schindler is a vain and greedy German businessman who becomes an unlikely humanitarian amid the barbaric German Nazi reign when he feels compelled to turn his factory into a refuge for Jews. Based on the true story of Oskar Schindler who managed to save about 1100 Jews from being gassed at the Auschwitz concentration camp, it is a testament to the good in all of us.","$96,898,818"
{'0167260': '7. The Lord of the Rings: The Return of the King'},The Lord of the Rings: The Return of the King,2003,PG-13,3h 21m,"['Action', 'Adventure', 'Drama']",{'Peter Jackson': '0001392'},"{'J.R.R. Tolkien': '0866058', 'Fran Walsh': '0909638', 'Philippa Boyens': '0101991'}","{'Elijah Wood': '0000704', 'Viggo Mortensen': '0001557', 'Ian McKellen': '0005212'}","The final confrontation between the forces of good and evil fighting for control of the future of Middle-earth. Frodo and Sam reach Mordor in their quest to destroy the One Ring, while Aragorn leads the forces of good against Sauron's evil army at the stone city of Minas Tirith.","$379,427,292"
{'0110912': '8. Pulp Fiction'},Pulp Fiction,1994,R,2h 34m,"['Crime', 'Drama']",{'Quentin Tarantino': '0000233'},"{'Quentin Tarantino': '0000233', 'Roger Avary': '0000812'}","{'John Travolta': '0000237', 'Uma Thurman': '0000235', 'Samuel L. Jackson': '0000168'}","Jules Winnfield (<a class=""ipc-md-link ipc-md-link--entity"" href=""/name/nm0000168/"">Samuel L. Jackson</a>) and Vincent Vega (<a class=""ipc-md-link ipc-md-link--entity"" href=""/name/nm0000237/"">John Travolta</a>) are two hit men who are out to retrieve a suitcase stolen from their employer, mob boss Marsellus Wallace (<a class=""ipc-md-link ipc-md-link--entity"" href=""/name/nm0000609/"">Ving Rhames</a>). Wallace has also asked Vincent to take his wife Mia (<a class=""ipc-md-link ipc-md-link--entity"" href=""/name/nm0000235/"">Uma Thurman</a>) out a few days later when Wallace himself will be out of town. Butch Coolidge (<a class=""ipc-md-link ipc-md-link--entity"" href=""/name/nm0000246/"">Bruce Willis</a>) is an aging boxer who is paid by Wallace to lose his fight. The lives of these seemingly unrelated people are woven together comprising of a series of funny, bizarre and uncalled-for incidents.","$107,928,762"
{'0120737': '9. The Lord of the Rings: The Fellowship of the Ring'},The Lord of the Rings: The Fellowship of the Ring,2001,PG-13,2h 58m,"['Action', 'Adventure', 'Drama']",{'Peter Jackson': '0001392'},"{'J.R.R. Tolkien': '0866058', 'Fran Walsh': '0909638', 'Philippa Boyens': '0101991'}","{'Elijah Wood': '0000704', 'Ian McKellen': '0005212', 'Orlando Bloom': '0089217'}","An ancient Ring thought lost for centuries has been found, and through a strange twist of fate has been given to a small Hobbit named Frodo. When Gandalf discovers the Ring is in fact the One Ring of the Dark Lord Sauron, Frodo must make an epic quest to the Cracks of Doom in order to destroy it. However, he does not go alone. He is joined by Gandalf, Legolas the elf, Gimli the Dwarf, Aragorn, Boromir, and his three Hobbit friends Merry, Pippin, and Samwise. Through mountains, snow, darkness, forests, rivers and plains, facing evil and danger at every corner the Fellowship of the Ring must go. Their quest to destroy the One Ring is the only hope for the end of the Dark Lords reign.","$316,115,420"
"{'0060196': '10. The Good, the Bad and the Ugly'}","The Good, the Bad and the Ugly",1966,Approved,2h 58m,"['Adventure', 'Western']",{'Sergio Leone': '0001466'},"{'Luciano Vincenzoni': '0898812', 'Sergio Leone': '0001466', 'Agenore Incrocci': '0408488'}","{'Clint Eastwood': '0000142', 'Eli Wallach': '0908919', 'Lee Van Cleef': '0001812'}","Blondie, The Good (Clint Eastwood), is a professional gunslinger who is out trying to earn a few dollars. Angel Eyes, The Bad (Lee Van Cleef), is a hitman who always commits to a task and sees it through--as long as he's paid to do so. And Tuco, The Ugly (Eli Wallach), is a wanted outlaw trying to take care of his own hide. Tuco and Blondie share a partnership making money off of Tuco's bounty, but when Blondie unties the partnership, Tuco tries to hunt down Blondie. When Blondie and Tuco come across a horse carriage loaded with dead bodies, they soon learn from the only survivor, Bill Carson (Antonio Casale), that he and a few other men have buried a stash of gold in a cemetery. Unfortunately, Carson dies and Tuco only finds out the name of the cemetery, while Blondie finds out the name on the grave. Now the two must keep each other alive in order to find the gold. Angel Eyes (who had been looking for Bill Carson) discovers that Tuco and Blondie met with Carson and knows they know where the gold is; now he needs them to lead him to it. Now The Good, the Bad, and the Ugly must all battle it out to get their hands on $200,000.00 worth of gold.","$25,100,000"
{'0109830': '11. Forrest Gump'},Forrest Gump,1994,PG-13,2h 22m,"['Drama', 'Romance']",{'Robert Zemeckis': '0000709'},"{'Winston Groom': '0343165', 'Eric Roth': '0744839'}","{'Tom Hanks': '0000158', 'Robin Wright': '0000705', 'Gary Sinise': '0000641'}","Forrest Gump is a simple man with a low I.Q. but good intentions. He is running through childhood with his best and only friend Jenny. His 'mama' teaches him the ways of life and leaves him to choose his destiny. Forrest joins the army for service in Vietnam, finding new friends called Dan and Bubba, he wins medals, creates a famous shrimp fishing fleet, inspires people to jog, starts a ping-pong craze, creates the smiley, writes bumper stickers and songs, donates to people and meets the president several times. However, this is all irrelevant to Forrest who can only think of his childhood sweetheart Jenny Curran, who has messed up her life. Although in the end all he wants to prove is that anyone can love anyone.","$330,455,270"
{'0137523': '12. Fight Club'},Fight Club,1999,R,2h 19m,['Drama'],{'David Fincher': '0000399'},"{'Chuck Palahniuk': '0657333', 'Jim Uhls': '0880243'}","{'Brad Pitt': '0000093', 'Edward Norton': '0001570', 'Meat Loaf': '0001533'}","A nameless first person narrator (<a class=""ipc-md-link ipc-md-link--entity"" href=""/name/nm0001570/"">Edward Norton</a>) attends support groups in attempt to subdue his emotional state and relieve his insomniac state. When he meets Marla (<a class=""ipc-md-link ipc-md-link--entity"" href=""/name/nm0000307/"">Helena Bonham Carter</a>), another fake attendee of support groups, his life seems to become a little more bearable. However when he associates himself with Tyler (<a class=""ipc-md-link ipc-md-link--entity"" href=""/name/nm0000093/"">Brad Pitt</a>) he is dragged into an underground fight club and soap making scheme. Together the two men spiral out of control and engage in competitive rivalry for love and power.","$37,030,102"
{'0167261': '13. The Lord of the Rings: The Two Towers'},The Lord of the Rings: The Two Towers,2002,PG-13,2h 59m,"['Action', 'Adventure', 'Drama']",{'Peter Jackson': '0001392'},"{'J.R.R. Tolkien': '0866058', 'Fran Walsh': '0909638', 'Philippa Boyens': '0101991'}","{'Elijah Wood': '0000704', 'Ian McKellen': '0005212', 'Viggo Mortensen': '0001557'}","The continuing quest of Frodo and the Fellowship to destroy the One Ring. Frodo and Sam discover they are being followed by the mysterious Gollum. Aragorn, the Elf archer Legolas, and Gimli the Dwarf encounter the besieged Rohan kingdom, whose once great King Theoden has fallen under Saruman's deadly spell.","$342,952,511"
{'1375666': '14. Inception'},Inception,2010,PG-13,2h 28m,"['Action', 'Adventure', 'Sci-Fi']",{'Christopher Nolan': '0634240'},{'Christopher Nolan': '0634240'},"{'Leonardo DiCaprio': '0000138', 'Joseph Gordon-Levitt': '0330687', 'Elliot Page': '0680983'}","Dom Cobb is a skilled thief, the absolute best in the dangerous art of extraction, stealing valuable secrets from deep within the subconscious during the dream state, when the mind is at its most vulnerable. Cobb's rare ability has made him a coveted player in this treacherous new world of corporate espionage, but it has also made him an international fugitive and cost him everything he has ever loved. Now Cobb is being offered a chance at redemption. One last job could give him his life back but only if he can accomplish the impossible, inception. Instead of the perfect heist, Cobb and his team of specialists have to pull off the reverse: their task is not to steal an idea, but to plant one. If they succeed, it could be the perfect crime. But no amount of careful planning or expertise can prepare the team for the dangerous enemy that seems to predict their every move. An enemy that only Cobb could have seen coming.","$292,587,330"
{'0080684': '15. Star Wars: Episode V - The Empire Strikes Back'},Star Wars: Episode V - The Empire Strikes Back,1980,PG,2h 4m,"['Action', 'Adventure', 'Fantasy']",{'Irvin Kershner': '0449984'},"{'Leigh Brackett': '0102824', 'Lawrence Kasdan': '0001410', 'George Lucas': '0000184'}","{'Mark Hamill': '0000434', 'Harrison Ford': '0000148', 'Carrie Fisher': '0000402'}","The legendary saga continues as the Rebel Alliance faces increasing challenges from the powerful Galactic Empire. Luke Skywalker, Han Solo, and Princess Leia Organa find themselves confronting new trials that test their courage, friendships, and beliefs. The Rebel Alliance has established a hidden base on the icy planet of Hoth, where they hope to regroup and plan their next moves against the Empire. Luke Skywalker receives a message from a familiar source, prompting him to seek further guidance in understanding his connection to the Force. Han Solo and Princess Leia's journey takes them on a perilous path as they navigate through a galaxy under Imperial control. Their actions and decisions lead to unforeseen consequences that will impact the fate of the Rebellion. Meanwhile, the dark presence of Darth Vader looms, as he relentlessly pursues the Rebels while dealing with inner conflicts of his own.","$292,753,960"
{'0133093': '16. The Matrix'},The Matrix,1999,R,2h 16m,"['Action', 'Sci-Fi']","{'Lana Wachowski': '0905154', 'Lilly Wachowski': '0905152'}","{'Lilly Wachowski': '0905152', 'Lana Wachowski': '0905154'}","{'Keanu Reeves': '0000206', 'Laurence Fishburne': '0000401', 'Carrie-Anne Moss': '0005251'}","Thomas A. Anderson is a man living two lives. By day he is an average computer programmer and by night a hacker known as Neo. Neo has always questioned his reality, but the truth is far beyond his imagination. Neo finds himself targeted by the police when he is contacted by Morpheus, a legendary computer hacker branded a terrorist by the government. As a rebel against the machines, Neo must confront the agents: super-powerful computer programs devoted to stopping Neo and the entire human rebellion.","$172,076,928"
{'0099685': '17. Goodfellas'},Goodfellas,1990,R,2h 25m,"['Biography', 'Crime', 'Drama']",{'Martin Scorsese': '0000217'},"{'Nicholas Pileggi': '0683380', 'Martin Scorsese': '0000217'}","{'Robert De Niro': '0000134', 'Ray Liotta': '0000501', 'Joe Pesci': '0000582'}","Henry Hill might be a small time gangster, who may have taken part in a robbery with Jimmy Conway and Tommy De Vito, two other gangsters who might have set their sights a bit higher. His two partners could kill off everyone else involved in the robbery, and slowly start to think about climbing up through the hierarchy of the Mob. Henry, however, might be badly affected by his partners' success, but will he consider stooping low enough to bring about the downfall of Jimmy and Tommy?","$46,909,721"
"{'0073486': ""18. One Flew Over the Cuckoo's Nest""}",One Flew Over the Cuckoo's Nest,1975,R,2h 13m,['Drama'],{'Milos Forman': '0001232'},"{'Lawrence Hauben': '0369142', 'Bo Goldman': '0325743', 'Ken Kesey': '0450181'}","{'Jack Nicholson': '0000197', 'Louise Fletcher': '0001221', 'Michael Berryman': '0077720'}","McMurphy has a criminal past and has once again gotten himself into trouble and is sentenced by the court. To escape labor duties in prison, McMurphy pleads insanity and is sent to a ward for the mentally unstable. Once here, McMurphy both endures and stands witness to the abuse and degradation of the oppressive Nurse Ratched, who gains superiority and power through the flaws of the other inmates. McMurphy and the other inmates band together to make a rebellious stance against the atrocious Nurse.","$108,981,275"
{'9362722': '19. Spider-Man: Across the Spider-Verse'},Spider-Man: Across the Spider-Verse,2023,PG,2h 20m,"['Animation', 'Action', 'Adventure']","{'Joaquim Dos Santos': '1690966', 'Kemp Powers': '5358492', 'Justin K. Thompson': '1042511'}","{'Phil Lord': '0520488', 'Christopher Miller': '0588087', 'Dave Callaham': '1709264'}","{'Shameik Moore': '4271336', 'Hailee Steinfeld': '2794962', 'Brian Tyree Henry': '3109964'}","Miles Morales returns for the next chapter of the Oscar®-winning Spider-Verse saga, an epic adventure that will transport Brooklyn's full-time, friendly neighborhood Spider-Man across the Multiverse to join forces with Gwen Stacy and a new team of Spider-People to face off with a villain more powerful than anything they have ever encountered.","$381,210,457"
{'0114369': '20. Se7en'},Se7en,1995,R,2h 7m,"['Crime', 'Drama', 'Mystery']",{'David Fincher': '0000399'},{'Andrew Kevin Walker': '0001825'},"{'Morgan Freeman': '0000151', 'Brad Pitt': '0000093', 'Kevin Spacey': '0000228'}","A film about two homicide detectives' (<a class=""ipc-md-link ipc-md-link--entity"" href=""/name/nm0000151/"">Morgan Freeman</a> and <a class=""ipc-md-link ipc-md-link--entity"" href=""/name/nm0000093/"">Brad Pitt</a>) desperate hunt for a serial killer who justifies his crimes as absolution for the world's ignorance of the Seven Deadly Sins. The movie takes us from the tortured remains of one victim to the next as the sociopathic ""John Doe"" (<a class=""ipc-md-link ipc-md-link--entity"" href=""/name/nm0000228/"">Kevin Spacey</a>) sermonizes to Detectives Somerset and Mills -- one sin at a time. The sin of Gluttony comes first and the murderer's terrible capacity is graphically demonstrated in the dark and subdued tones characteristic of film noir. The seasoned and cultured but jaded Somerset researches the Seven Deadly Sins in an effort to understand the killer's modus operandi while the bright but green and impulsive Detective Mills (Pitt) scoffs at his efforts to get inside the mind of a killer...","$100,125,643"
"{'0038650': ""21. It's a Wonderful Life""}",It's a Wonderful Life,1946,PG,2h 10m,"['Drama', 'Family', 'Fantasy']",{'Frank Capra': '0001008'},"{'Frances Goodrich': '0329304', 'Albert Hackett': '0352443', 'Frank Capra': '0001008'}","{'James Stewart': '0000071', 'Donna Reed': '0001656', 'Lionel Barrymore': '0000859'}","George Bailey has spent his entire life giving of himself to the people of Bedford Falls. He has always longed to travel but never had the opportunity in order to prevent rich skinflint Mr. Potter from taking over the entire town. All that prevents him from doing so is George's modest building and loan company, which was founded by his generous father. But on Christmas Eve, George's Uncle Billy loses the business's $8,000 while intending to deposit it in the bank. Mr. Potter finds the misplaced money and hides it from Uncle Billy. When the bank examiner discovers the shortage later that night, George realizes that he will be held responsible and sent to jail and the company will collapse, finally allowing Mr. Potter to take over the town. Thinking of his wife, Mary, their four children, and others he loves will be better off with him dead, he contemplates suicide. But the prayers of his loved ones result in his guardian angel named Clarence Odbody coming to Earth to help him, with the promise of earning his wings. He shows him what things would have been like if he had never been born.","$1,483,643"
{'0047478': '22. Seven Samurai'},Seven Samurai,1954,Not Rated,3h 27m,"['Action', 'Drama']",{'Akira Kurosawa': '0000041'},"{'Akira Kurosawa': '0000041', 'Shinobu Hashimoto': '0368074', 'Hideo Oguni': '0644823'}","{'Toshirô Mifune': '0001536', 'Takashi Shimura': '0793766', 'Keiko Tsushima': '0875477'}","A veteran samurai, who has fallen on hard times, answers a village's request for protection from bandits. He gathers 6 other samurai to help him, and they teach the townspeople how to defend themselves, and they supply the samurai with three small meals a day. The film culminates in a giant battle when 40 bandits attack the village.","$318,649"
{'0102926': '23. The Silence of the Lambs'},The Silence of the Lambs,1991,R,1h 58m,"['Crime', 'Drama', 'Thriller']",{'Jonathan Demme': '0001129'},"{'Thomas Harris': '0365383', 'Ted Tally': '0848217'}","{'Jodie Foster': '0000149', 'Anthony Hopkins': '0000164', 'Lawrence A. Bonney': '0095029'}","F.B.I. trainee Clarice Starling (Jodie Foster) works hard to advance her career, while trying to hide or put behind her West Virginia roots, of which if some knew, would automatically classify her as being backward or white trash. After graduation, she aspires to work in the agency's Behavioral Science Unit under the leadership of Jack Crawford (Scott Glenn). While she is still a trainee, Crawford asks her to question Dr. Hannibal Lecter (Sir Anthony Hopkins), a psychiatrist imprisoned, thus far, for eight years in maximum security isolation for being a serial killer who cannibalized his victims. Clarice is able to figure out the assignment is to pick Lecter's brains to help them solve another serial murder case, that of someone coined by the media as ""Buffalo Bill"" (Ted Levine), who has so far killed five victims, all located in the eastern U.S., all young women, who are slightly overweight (especially around the hips), all who were drowned in natural bodies of water, and all who were stripped of large swaths of skin. She also figures that Crawford chose her, as a woman, to be able to trigger some emotional response from Lecter. After speaking to Lecter for the first time, she realizes that everything with him will be a psychological game, with her often having to read between the very cryptic lines he provides. She has to decide how much she will play along, as his request in return for talking to him is to expose herself emotionally to him. The case takes a more dire turn when a sixth victim is discovered, this one from who they are able to retrieve a key piece of evidence, if Lecter is being forthright as to its meaning. A potential seventh victim is high profile Catherine Martin (Brooke Smith), the daughter of Senator Ruth Martin (Diane Baker), which places greater scrutiny on the case as they search for a hopefully still alive Catherine. Who may factor into what happens is Dr. Frederick Chilton (Anthony Heald), the warden at the prison, an opportunist who sees the higher profile with Catherine, meaning a higher profile for himself if he can insert himself successfully into the proceedings.","$130,742,922"
{'0816692': '24. Interstellar'},Interstellar,2014,PG-13,2h 49m,"['Adventure', 'Drama', 'Sci-Fi']",{'Christopher Nolan': '0634240'},"{'Jonathan Nolan': '0634300', 'Christopher Nolan': '0634240'}","{'Matthew McConaughey': '0000190', 'Anne Hathaway': '0004266', 'Jessica Chastain': '1567113'}","Earth's future has been riddled by disasters, famines, and droughts. There is only one way to ensure mankind's survival: Interstellar travel. A newly discovered wormhole in the far reaches of our solar system allows a team of astronauts to go where no man has gone before, a planet that may have the right environment to sustain human life.","$188,020,017"
{'0120815': '25. Saving Private Ryan'},Saving Private Ryan,1998,R,2h 49m,"['Drama', 'War']",{'Steven Spielberg': '0000229'},{'Robert Rodat': '0734441'},"{'Tom Hanks': '0000158', 'Matt Damon': '0000354', 'Tom Sizemore': '0001744'}","Opening with the Allied invasion of Normandy on 6 June 1944, members of the 2nd Ranger Battalion under Cpt. Miller fight ashore to secure a beachhead. Amidst the fighting, two brothers are killed in action. Earlier in New Guinea, a third brother is KIA. Their mother, Mrs. Ryan, is to receive all three of the grave telegrams on the same day. The United States Army Chief of Staff, George C. Marshall, is given an opportunity to alleviate some of her grief when he learns of a fourth brother, Private James Ryan, and decides to send out 8 men (Cpt. Miller and select members from 2nd Rangers) to find him and bring him back home to his mother...","$217,049,603"
{'0317248': '26. City of God'},City of God,2002,R,2h 10m,"['Crime', 'Drama']","{'Fernando Meirelles': '0576987', 'Kátia Lund': '0526199'}","{'Paulo Lins': '0513130', 'Bráulio Mantovani': '1130251'}","{'Alexandre Rodrigues': '1179105', 'Leandro Firmino': '1129884', 'Matheus Nachtergaele': '0618690'}","Brazil, 1960s, City of God. The Tender Trio robs motels and gas trucks. Younger kids watch and learn well...too well. 1970s: Li'l Zé has prospered very well and owns the city. He causes violence and fear as he wipes out rival gangs without mercy. His best friend Bené is the only one to keep him on the good side of sanity. Rocket has watched these two gain power for years, and he wants no part of it. he keeps getting swept up in the madness. All he wants to do is take pictures. 1980s: Things are out of control between the last two remaining gangs...will it ever end? Welcome to the City of God.","$7,564,459"
