dict_id,title,year,parental_guide,runtime,genre,directore,writer,star,storyline,gross_us_canada
{'0036775': '104. Double Indemnity'},Double Indemnity,1944,Passed,1h 47m,"['Crime', 'Drama', 'Film-Noir']",{'Billy Wilder': '0000697'},"{'Billy Wilder': '0000697', 'Raymond Chandler': '0151452', 'James M. Cain': '0128906'}","{'Fred MacMurray': '0534045', 'Barbara Stanwyck': '0001766', 'Edward G. Robinson': '0000064'}","In 1938, Walter Neff, an experienced salesman of the Pacific All Risk Insurance Co., meets the seductive wife of one of his clients, Phyllis Dietrichson, and they have an affair. Phyllis proposes to kill her husband to receive the proceeds of an accident insurance policy and Walter devises a scheme to receive twice the amount based on a double indemnity clause. When Mr. Dietrichson is found dead on a train track, the police accept the determination of accidental death. However, the insurance analyst and Walter's best friend Barton Keyes does not buy the story and suspects that Phyllis has murdered her husband with the help of another man.",
{'0211915': '105. Amélie'},Amélie,2001,R,2h 2m,"['Comedy', 'Romance']",{'Jean-Pierre Jeunet': '0000466'},"{'Guillaume Laurant': '0491011', 'Jean-Pierre Jeunet': '0000466'}","{'Audrey Tautou': '0851582', 'Mathieu Kassovitz': '0440913', 'Rufus': '0749363'}","Amélie is a story about a girl named Amélie whose childhood was suppressed by her Father's mistaken concerns of a heart defect. With these concerns Amélie gets hardly any real-life contact with other people. This leads Amélie to resort to her own fantastical world and dreams of love and beauty. She later on becomes a young woman and moves to the central part of Paris as a waitress. After finding a lost treasure belonging to the former occupant of her apartment, she decides to return it to him. After seeing his reaction and his new found perspective - she decides to devote her life to the people around her. Such as, her father who is obsessed with his garden-gnome, a failed writer, a hypochondriac, a man who stalks his ex girlfriends, the ""ghost,"" a suppressed young soul, the love of her life and a man whose bones are as brittle as glass. But after consuming herself with these escapades - she finds out that she is disregarding her own life and damaging her quest for love. Amélie then discovers she must become more aggressive and take a hold of her life and capture the beauty of love she has always dreamed of.","$33,225,499"
{'0086250': '106. Scarface'},Scarface,1983,18+,2h 50m,"['Crime', 'Drama']",{'Brian De Palma': '0000361'},"{'Oliver Stone': '0000231', 'Howard Hawks': '0001328', 'Ben Hecht': '0372942'}","{'Al Pacino': '0000199', 'Michelle Pfeiffer': '0000201', 'Steven Bauer': '0000874'}","Tony Montana manages to leave Cuba during the Mariel exodus of 1980. He finds himself in a Florida refugee camp but his friend Manny has a way out for them: undertake a contract killing and arrangements will be made to get a green card. He's soon working for drug dealer Frank Lopez and shows his mettle when a deal with Colombian drug dealers goes bad. He also brings a new level of violence to Miami. Tony is protective of his younger sister but his mother knows what he does for a living and disowns him. Tony is impatient and wants it all however, including Frank's empire and his mistress Elvira Hancock. Once at the top however, Tony's outrageous actions make him a target and everything comes crumbling down.","$45,408,703"
{'0093058': '107. Full Metal Jacket'},Full Metal Jacket,1987,R,1h 56m,"['Drama', 'War']",{'Stanley Kubrick': '0000040'},"{'Stanley Kubrick': '0000040', 'Michael Herr': '0380282', 'Gustav Hasford': '0368007'}","{'Matthew Modine': '0000546', 'R. Lee Ermey': '0000388', ""Vincent D'Onofrio"": '0000352'}","A two-segment look at the effect of the military mindset and war itself on Vietnam era Marines. The first half follows a group of recruits in boot camp under the command of the punishing Gunnery Sergeant Hartman. The second half shows one of those recruits, Joker, covering the war as a correspondent for Stars and Stripes, focusing on the Tet offensive.","$46,357,676"
{'0066921': '108. A Clockwork Orange'},A Clockwork Orange,1971,X,2h 16m,"['Crime', 'Sci-Fi']",{'Stanley Kubrick': '0000040'},"{'Stanley Kubrick': '0000040', 'Anthony Burgess': '0121256'}","{'Malcolm McDowell': '0000532', 'Patrick Magee': '0535861', 'Michael Bates': '0060988'}","Protagonist Alex DeLarge is an ""ultraviolent"" youth in futuristic Britain. As with all luck, his eventually runs out and he's arrested and convicted of murder. While in prison, Alex learns of an experimental program in which convicts are programmed to detest violence. If he goes through the program, his sentence will be reduced and he will be back on the streets sooner than expected. But Alex's ordeals are far from over once he hits the streets of Britain..","$26,617,553"
{'1255953': '109. Incendies'},Incendies,2010,R,2h 11m,"['Drama', 'Mystery', 'War']",{'Denis Villeneuve': '0898288'},"{'Denis Villeneuve': '0898288', 'Wajdi Mouawad': '1416431', 'Valérie Beaugrand-Champagne': '4034068'}","{'Lubna Azabal': '0044073', 'Mélissa Désormeaux-Poulin': '0246386', 'Maxim Gaudette': '0309945'}","A mother's last wishes send twins Jeanne and Simon on a journey to the Middle East in search of their tangled roots. Adapted from Wajdi Mouawad's acclaimed play, Incendies tells the powerful and moving tale of two young adults' voyage to the core of deep-rooted hatred, never-ending wars and enduring love.","$2,071,334"
{'8503618': '110. Hamilton'},Hamilton,2020,PG-13,2h 40m,"['Biography', 'Drama', 'History']",{'Thomas Kail': '2371802'},"{'Lin-Manuel Miranda': '0592135', 'Ron Chernow': '2375857'}","{'Lin-Manuel Miranda': '0592135', 'Phillipa Soo': '5623883', 'Leslie Odom Jr.': '1502434'}","""Hamilton"" is the story of America then, told by America now. Featuring a score that blends hip-hop, jazz, R&B, and show tunes, ""Hamilton"" has taken the story of American founding father Alexander Hamilton and created a revolutionary moment in theater--a musical that has had a profound impact on culture, politics, and education. Captured at the Richard Rodgers Theater on Broadway in June 2016, the film transports its audience into the world of the Broadway show in a uniquely intimate way.",
{'0113277': '111. Heat'},Heat,1995,R,2h 50m,"['Action', 'Crime', 'Drama']",{'Michael Mann': '0000520'},{'Michael Mann': '0000520'},"{'Al Pacino': '0000199', 'Robert De Niro': '0000134', 'Val Kilmer': '0000174'}","Hunters and their prey--Neil and his professional criminal crew hunt to score big money targets (banks, vaults, armored cars) and are, in turn, hunted by Lt. Vincent Hanna and his team of cops in the Robbery/Homicide police division. A botched job puts Hanna onto their trail while they regroup and try to put together one last big 'retirement' score. Neil and Vincent are similar in many ways, including their troubled personal lives. At a crucial moment in his life, Neil disobeys the dictum taught to him long ago by his criminal mentor--'Never have anything in your life that you can't walk out on in thirty seconds flat, if you spot the heat coming around the corner'--as he falls in love. Thus the stage is set for the suspenseful ending....","$67,436,818"
{'1049413': '112. Up'},Up,2009,PG,1h 36m,"['Animation', 'Adventure', 'Comedy']","{'Pete Docter': '0230032', 'Bob Peterson': '0677037'}","{'Pete Docter': '0230032', 'Bob Peterson': '0677037', 'Tom McCarthy': '0565336'}","{'Edward Asner': '0000799', 'Jordan Nagai': '2973712', 'John Ratzenberger': '0001652'}","As a boy, Carl Fredricksen wanted to explore South America and find the forbidden Paradise Falls. About 64 years later he gets to begin his journey along with Boy Scout Russell by lifting his house with thousands of balloons. On their journey, they make many new friends including a talking dog, and figure out that someone has evil plans. Carl soon realizes that this evildoer is his childhood idol.","$293,004,164"
{'0056592': '113. To Kill a Mockingbird'},To Kill a Mockingbird,1962,Approved,2h 9m,"['Crime', 'Drama']",{'Robert Mulligan': '0612322'},"{'Harper Lee': '0497369', 'Horton Foote': '0285210'}","{'Gregory Peck': '0000060', 'John Megna': '0576345', 'Frank Overton': '0653942'}","In small-town Alabama in 1932, Atticus Finch (Gregory Peck) is a lawyer and a widower. He has two young children, Jem and Scout. Atticus Finch is currently defending Tom Robinson, a Black man accused of raping a white woman. Meanwhile, Jem and Scout are intrigued by their neighbors, the Radleys, in particular the mysterious, seldom-seen Boo Radley.","$592,237"
{'0070735': '114. The Sting'},The Sting,1973,PG,2h 9m,"['Comedy', 'Crime', 'Drama']",{'George Roy Hill': '0001351'},{'David S. Ward': '0911486'},"{'Paul Newman': '0000056', 'Robert Redford': '0000602', 'Robert Shaw': '0001727'}","Johnny Hooker, a small time grifter, unknowingly steals from Doyle Lonnegan, a big time crime boss, when he pulls a standard street con. Lonnegan demands satisfaction for the insult. After his partner, Luther, is killed, Hooker flees, and seeks the help of Henry Gondorff, one of Luther's contacts, who is a master of the long con. Hooker wants to use Gondorff's expertise to take Lonnegan for an enormous sum of money to even the score, since he admits he ""doesn't know enough about killing to kill him."" They devise a complicated scheme and amass a talented group of other con artists who want their share of the reparations. The stakes are high in this game, and our heroes must not only deal with Lonnegan's murderous tendencies, but also other side players who want a piece of the action. To win, Hooker and Gondorff will need all their skills...and a fair amount of confidence.","$156,000,000"
{'1832382': '115. A Separation'},A Separation,2011,PG-13,2h 3m,['Drama'],{'Asghar Farhadi': '1410815'},{'Asghar Farhadi': '1410815'},"{'Payman Maadi': '1818216', 'Leila Hatami': '0368689', 'Sareh Bayat': '4299147'}","Nader (<a class=""ipc-md-link ipc-md-link--entity"" href=""/name/nm1818216/"">Payman Maadi</a>) and Simin (<a class=""ipc-md-link ipc-md-link--entity"" href=""/name/nm0368689/"">Leila Hatami</a>) argue about living abroad. Simin prefers to live abroad to provide better opportunities for their only daughter, Termeh. However, Nader refuses to go because he thinks he must stay in Iran and take care of his father (Ali-Asghar Shahbazi), who suffers from Alzheimers. However, Simin is determined to get a divorce and leave the country with her daughter.","$7,099,055"
{'0097576': '116. Indiana Jones and the Last Crusade'},Indiana Jones and the Last Crusade,1989,PG-13,2h 7m,"['Action', 'Adventure']",{'Steven Spielberg': '0000229'},"{'Jeffrey Boam': '0090151', 'George Lucas': '0000184', 'Menno Meyjes': '0583675'}","{'Harrison Ford': '0000148', 'Sean Connery': '0000125', 'Alison Doody': '0233145'}","An art collector appeals to Indiana Jones to embark on a search for the Holy Grail. He learns that another archaeologist has disappeared while searching for the precious goblet, and the missing man is his own father, Dr. Henry Jones. The artifact is much harder to find than they expected, and its powers are too much for those impure of heart.","$197,171,806"
{'0017136': '117. Metropolis'},Metropolis,1927,Not Rated,2h 33m,"['Drama', 'Sci-Fi']",{'Fritz Lang': '0000485'},"{'Thea von Harbou': '0902376', 'Fritz Lang': '0000485'}","{'Brigitte Helm': '0375609', 'Alfred Abel': '0002154', 'Gustav Fröhlich': '0297054'}","Sometime in the future, the city of Metropolis is home to a Utopian society where its wealthy residents live a carefree life. One of those is Freder Fredersen. One day, he spots a beautiful woman with a group of children, she and the children quickly disappear. Trying to follow her, he is horrified to find an underground world of workers who apparently run the machinery that keeps the Utopian world above ground functioning. One of the few people above ground who knows about the world below is Freder's father, John Fredersen, who is the founder and master of Metropolis. Freder learns that the woman is called Maria, who espouses the need to join the ""hands"" - the workers - to the ""head"" - those in power above - by a mediator who will act as the ""heart"". Freder wants to help the plight of the workers in their struggle for a better life. But when John learns of what Maria is advocating and that Freder has joined their cause, with the assistance of an old colleague. an inventor called Rotwang, who turns out to be But their nemesis goes to works towards quashing a proposed uprising, with Maria at the centre of their plan. John, unaware that Rotwang has his own agenda., makes plans that include shutting down the machines, with the prospect of unleashing total anarchy both above and below ground.","$1,236,166"
{'0095016': '118. Die Hard'},Die Hard,1988,R,2h 12m,"['Action', 'Thriller']",{'John McTiernan': '0001532'},"{'Roderick Thorp': '0861636', 'Jeb Stuart': '0835732', 'Steven E. de Souza': '0211823'}","{'Bruce Willis': '0000246', 'Alan Rickman': '0000614', 'Bonnie Bedelia': '0000889'}","NYPD cop John McClane goes on a Christmas vacation to visit his wife Holly in Los Angeles where she works for the Nakatomi Corporation. While they are at the Nakatomi headquarters for a Christmas party, a group of robbers led by Hans Gruber take control of the building and hold everyone hostage, with the exception of John, while they plan to perform a lucrative heist. Unable to escape and with no immediate police response, John is forced to take matters into his own hands.","$83,844,093"
{'0119488': '119. L.A. Confidential'},L.A. Confidential,1997,R,2h 18m,"['Crime', 'Drama', 'Mystery']",{'Curtis Hanson': '0000436'},"{'James Ellroy': '0255278', 'Brian Helgeland': '0001338', 'Curtis Hanson': '0000436'}","{'Kevin Spacey': '0000228', 'Russell Crowe': '0000128', 'Guy Pearce': '0001602'}","1950's Los Angeles is the seedy backdrop for this intricate noir-ish tale of police corruption and Hollywood sleaze. Three very different cops are all after the truth, each in their own style: Ed Exley, the golden boy of the police force, willing to do almost anything to get ahead, except sell out; Bud White, ready to break the rules to seek justice, but barely able to keep his raging violence under control; and Jack Vincennes, always looking for celebrity and a quick buck until his conscience drives him to join Exley and White down the one-way path to find the truth behind the dark world of L.A. crime.","$64,616,940"
{'0040522': '120. Bicycle Thieves'},Bicycle Thieves,1948,Not Rated,1h 29m,['Drama'],{'Vittorio De Sica': '0001120'},"{'Cesare Zavattini': '0953790', 'Luigi Bartolini': '0059030', 'Oreste Biancoli': '0080755'}","{'Lamberto Maggiorani': '0536009', 'Enzo Staiola': '0821543', 'Lianella Carell': '0136794'}","Antonio Ricci, an unemployed man in the depressed post-WWII economy of Italy, finally gets a job hanging up posters, but he needs a bicycle. But when his bicycle is stolen,, he and son walk the streets of Rome looking for it. Antonio finally manages to locate the thief, but with no proof he must abandon his cause. But he and his son know perfectly well that without a bike, Antonio won't be able to keep his job.","$371,111"
{'0208092': '121. Snatch'},Snatch,2000,R,1h 42m,"['Comedy', 'Crime']",{'Guy Ritchie': '0005363'},{'Guy Ritchie': '0005363'},"{'Jason Statham': '0005458', 'Brad Pitt': '0000093', 'Stephen Graham': '0334318'}","Turkish and his close friend/accomplice Tommy get pulled into the world of match fixing by the notorious Brick Top. Things get complicated when the boxer they had lined up gets badly beaten by Mickey, who comes into the equation after Turkish, an unlicensed boxing promoter wants to buy a caravan off of Travellers. They then try to convince Mickey not only to fight for them, but to lose for them too. Whilst all this is going on, a huge diamond heist takes place, and a fistful of motley characters enter the story, including 'Cousin Avi', 'Boris The Blade', 'Franky Four Fingers' and 'Bullet Tooth Tony'. Things go from bad to worse as it all becomes about the money, the guns, and the damned dog.","$30,328,156"
{'0986264': '122. Like Stars on Earth'},Like Stars on Earth,2007,PG,2h 45m,"['Drama', 'Family']","{'Aamir Khan': '0451148', 'Amole Gupte': '1244760'}",{'Amole Gupte': '1244760'},"{'Darsheel Safary': '2594301', 'Aamir Khan': '0451148', 'Tanay Chheda': '2540053'}","Ishaan Awasthi is an eight-year-old child whose world is filled with wonders that no one else seems to appretiate are just not important in the world of adults, who are much more interested in things like homework, marks and neatness. And Ishaan just cannot seem to get anything right in class. When he gets into far more trouble than his parents can handle, he is packed off to a boarding school to 'be disciplined'. Things are no different at his new school, and Ishaan has to contend with the added trauma of separation from his family. One day a new art teacher bursts onto the scene, Ram Shankar Nikumbh, who infects the students with joy and optimism. He breaks all the rules of 'how things are done' by asking them to think, dream and imagine, and all the children respond with enthusiasm, all except Ishaan. Nikumbh soon realizes that Ishaan is very unhappy, and he sets out to discover why. With time, patience and care, he ultimately helps Ishaan find himself.","$1,223,869"
{'0075314': '123. Taxi Driver'},Taxi Driver,1976,R,1h 54m,"['Crime', 'Drama']",{'Martin Scorsese': '0000217'},{'Paul Schrader': '0001707'},"{'Robert De Niro': '0000134', 'Jodie Foster': '0000149', 'Cybill Shepherd': '0001732'}","Travis Bickle is an ex-Marine and Vietnam War veteran living in New York City. As he suffers from insomnia, he spends his time working as a taxi driver at night, watching porn movies at seedy cinemas during the day, or thinking about how the world, New York in particular, has deteriorated into a cesspool. He's a loner who has strong opinions about what is right and wrong with mankind. For him, the one bright spot in humanity is Betsy, a worker on the presidential nomination campaign of Senator Charles Palantine. After an incident, he believes he has to do whatever he needs to make the world a better place.","$28,262,574"
{'8579674': '124. 1917'},1917,2019,R,1h 59m,"['Action', 'Drama', 'War']",{'Sam Mendes': '0005222'},"{'Sam Mendes': '0005222', 'Krysty Wilson-Cairns': '4880670'}","{'Dean-Charles Chapman': '2835616', 'George MacKay': '1126657', 'Daniel Mays': '0990547'}","April 1917, the Western Front. Two British soldiers are sent to deliver an urgent message to an isolated regiment. If the message is not received in time the regiment will walk into a trap and be massacred. To get to the regiment they will need to cross through enemy territory. Time is of the essence and the journey will be fraught with danger.","$159,227,644"
{'0363163': '125. Downfall'},Downfall,2004,R,2h 36m,"['Biography', 'Drama', 'History']",{'Oliver Hirschbiegel': '0386570'},"{'Bernd Eichinger': '0251536', 'Joachim Fest': '0275264', 'Traudl Junge': '0432622'}","{'Bruno Ganz': '0004486', 'Alexandra Maria Lara': '0487884', 'Ulrich Matthes': '0559890'}","Charting the last 10 days of Hitler's life, from his 56th birthday on April 20th, 1945 to his suicide on April 30th, Downfall uses multiple characters to show the chaos of a country coming apart at the seams, from Hitler's henchman under the streets of Berlin, to the soldiers and civilians fighting and dying as the Soviet Army ravaged the city above. Nominated for an Oscar for Best Foreign Language Film in 2005.","$5,509,040"
{'5074352': '126. Dangal'},Dangal,2016,Not Rated,2h 41m,"['Action', 'Biography', 'Drama']",{'Nitesh Tiwari': '4318159'},"{'Piyush Gupta': '6328029', 'Shreyas Jain': '6328031', 'Nikhil Mehrotra': '6328030'}","{'Aamir Khan': '0451148', 'Sakshi Tanwar': '2799219', 'Fatima Sana Shaikh': '0760778'}","Biopic of <a class=""ipc-md-link ipc-md-link--entity"" href=""/name/nm10059137/"">Mahavir Singh Phogat</a>, who taught wrestling to his daughters <a class=""ipc-md-link ipc-md-link--entity"" href=""/name/nm10058909/"">Babita Kumari</a> and <a class=""ipc-md-link ipc-md-link--entity"" href=""/name/nm9858046/"">Geeta Phogat</a>. Geeta Phogat was India's first female wrestler to win at the 2010 Commonwealth Games, where she won the gold medal (55 kg) while her sister Babita Kumari won the silver (51 kg).","$12,391,761"
{'1745960': '127. Top Gun: Maverick'},Top Gun: Maverick,2022,PG-13,2h 10m,"['Action', 'Drama']",{'Joseph Kosinski': '2676052'},"{'Jim Cash': '0143596', 'Jack Epps Jr.': '0258390', 'Peter Craig': '0185976'}","{'Tom Cruise': '0000129', 'Jennifer Connelly': '0000124', 'Miles Teller': '1886602'}","Set 30 years after its predecessor, it follows Maverick's return to the United States Navy Strike Fighter Tactics Instructor program (also known as U.S. Navy-Fighter Weapons School - ""TOPGUN""), where he must confront his past as he trains a group of younger pilots, among them the son of Maverick's deceased best friend Lieutenant Nick ""Goose"" Bradshaw, USN.","$718,732,821"
{'0059578': '128. For a Few Dollars More'},For a Few Dollars More,1965,R,2h 12m,"['Drama', 'Western']",{'Sergio Leone': '0001466'},"{'Sergio Leone': '0001466', 'Fulvio Morsella': '0607694', 'Luciano Vincenzoni': '0898812'}","{'Clint Eastwood': '0000142', 'Lee Van Cleef': '0001812', 'Gian Maria Volontè': '0002231'}","Drifting from town to town, the poncho-clad Man with No Name and the lightning-fast right hand rides into the town of El Paso in search of maniacal escaped convict El Indio. It's been 18 short months since the deadly confrontation in <a class=""ipc-md-link ipc-md-link--entity"" href=""/title/tt0058461/"">A Fistful of Dollars (1964)</a>, and this time, the solitary stranger, now a professional bounty hunter, must go against his beliefs and do the unthinkable: join forces with hawk-eyed marksman Colonel Douglas Mortimer to collect the hefty reward. Now, as El Indio and his cut-throats have already set their sights on robbing the crammed-with-cash Bank of El Paso, the stage is set for a bloody showdown at high noon, against the backdrop of silent double-crosses and fragile allegiances. But, is it worth dicing with death for a few dollars more?","$15,000,000"
{'0372784': '129. Batman Begins'},Batman Begins,2005,PG-13,2h 20m,"['Action', 'Crime', 'Drama']",{'Christopher Nolan': '0634240'},"{'Bob Kane': '0004170', 'David S. Goyer': '0275286', 'Christopher Nolan': '0634240'}","{'Christian Bale': '0000288', 'Michael Caine': '0000323', 'Ken Watanabe': '0913822'}","When his parents are killed, billionaire playboy Bruce Wayne relocates to Asia, where he is mentored by Henri Ducard and Ra's Al Ghul in how to fight evil. When learning about the plan to wipe out evil in Gotham City by Ducard, Bruce prevents this plan from getting any further and heads back to his home. Back in his original surroundings, Bruce adopts the image of a bat to strike fear into the criminals and the corrupt as the icon known as ""Batman"". But it doesn't stay quiet for long.","$206,863,479"
{'0053291': '130. Some Like It Hot'},Some Like It Hot,1959,Passed,2h 1m,"['Comedy', 'Music', 'Romance']",{'Billy Wilder': '0000697'},"{'Billy Wilder': '0000697', 'I.A.L. Diamond': '0224634', 'Robert Thoeren': '0858329'}","{'Marilyn Monroe': '0000054', 'Tony Curtis': '0000348', 'Jack Lemmon': '0000493'}","After two Chicago musicians, Joe and Jerry, witness the the St. Valentine's Day massacre, they want to get out of town and get away from the gangster responsible, Spats Colombo. They're desperate to get a gig out of town but the only job they know of is in an all-girl band heading to Florida. They show up at the train station as Josephine and Daphne, the replacement saxophone and bass players. They certainly enjoy being around the girls, especially Sugar Kane Kowalczyk who sings and plays the ukulele. Joe in particular sets out to woo her while Jerry/Daphne is wooed by a millionaire, Osgood Fielding III. Mayhem ensues as the two men try to keep their true identities hidden and Spats Colombo and his crew show up for a meeting with several other crime lords.",
{'0012349': '131. The Kid'},The Kid,1921,Passed,1h 8m,"['Comedy', 'Drama', 'Family']",{'Charles Chaplin': '0000122'},{'Charles Chaplin': '0000122'},"{'Charles Chaplin': '0000122', 'Edna Purviance': '0701012', 'Jackie Coogan': '0001067'}","A woman decides to abandon her baby in the backseat of an automobile with a handwritten note attached, beseeching the finder to care for and love the child. The baby is discovered by the initially-reluctant Tramp, who eventually softens and comes to love him as his own. As the boy grows up, both he and The Tramp must learn to navigate through a life that spawns one adventure after another.",
